URL,Version,Status,OIDs,Name,Title,Descriptino,Uses,Used,Sources
http://hl7.org/fhir/ValueSet/languages,4.0.1,draft,"2.16.840.1.113883.4.642.3.20",CommonLanguages,Common Languages,"This value set includes common codes from BCP-47 (http://tools.ietf.org/html/bcp47)","StructureDefinition/isik-koerpergewicht,StructureDefinition/utn-patient,StructureDefinition/utn-icu-extrakorporales-verfahren,StructureDefinition/utn-service-request,StructureDefinition/utn-consent-documentreference-id,StructureDefinition/profile-consent-management-questionnaireresponse,StructureDefinition/utn-isik-atemfrequenz,StructureDefinition/utn-consent-id,StructureDefinition/utn-observation-arterieller-blutdruck,StructureDefinition/utn-diagnostik-report,StructureDefinition/consent-management-provenance,StructureDefinition/mii-kreatinin,StructureDefinition/utn-documentreference,StructureDefinition/utn-encounter,StructureDefinition/utn-procedure,StructureDefinition/isik-herzfrequenz,StructureDefinition/KBV-PR-Base-Practitioner,StructureDefinition/healthcare-service,StructureDefinition/utn-procedure-beatmung,StructureDefinition/teleconsult-communication,StructureDefinition/utn-PR-Base-PractitionerRole,StructureDefinition/isik-koerpertemperatur","hl7.terminology.r4"
http://hl7.org/fhir/ValueSet/link-type,4.0.1,active,"2.16.840.1.113883.4.642.3.423",LinkType,LinkType,"The type of link between this patient resource and another patient resource.","StructureDefinition/utn-patient","hl7.fhir.r4.core"
http://hl7.org/fhir/ValueSet/location-physical-type,4.0.1,draft,"2.16.840.1.113883.4.642.3.328",LocationType,Location type,"This example value set defines a set of codes that can be used to indicate the physical form of the Location.","StructureDefinition/utn-encounter","THO"
http://hl7.org/fhir/ValueSet/marital-status,4.0.1,active,"2.16.840.1.113883.4.642.3.29",Marital Status Codes,MaritalStatus,"This value set defines the set of codes that can be used to indicate the marital status of a person.","StructureDefinition/utn-patient","THO (V3)"
http://hl7.org/fhir/ValueSet/medication-as-needed-reason,4.0.1,draft,"2.16.840.1.113883.4.642.3.96",SNOMEDCTMedicationAsNeededReasonCodes,SNOMED CT Medication As Needed Reason Codes,"This value set includes all clinical findings from SNOMED CT - provided as an exemplar value set.","StructureDefinition/utn-service-request","SCT"
http://hl7.org/fhir/ValueSet/mimetypes,4.0.1,active,"2.16.840.1.113883.4.642.3.1024",Mime Types,MimeType,"This value set includes all possible codes from BCP-13 (http://tools.ietf.org/html/bcp13)","StructureDefinition/consent-management-provenance,StructureDefinition/utn-consent-documentreference-id","Other"
http://hl7.org/fhir/ValueSet/name-part-qualifier,4.0.1,draft,"2.16.840.1.113883.4.642.3.906",EntityNamePartQualifier,EntityNamePartQualifier,"A set of codes each of which specifies a certain subcategory of the name part in addition to the main name part type.","StructureDefinition/KBV-PR-Base-Practitioner","THO (V3)"
http://hl7.org/fhir/ValueSet/name-use,4.0.1,active,"2.16.840.1.113883.4.642.3.65",NameUse,NameUse,"The use of a human name.","StructureDefinition/KBV-PR-Base-Practitioner","hl7.fhir.r4.core"
http://hl7.org/fhir/ValueSet/observation-category,4.0.1,draft,"2.16.840.1.113883.4.642.3.403",ObservationCategoryCodes,Observation Category Codes,"Observation Category codes.","StructureDefinition/isik-koerpergewicht,StructureDefinition/mii-kreatinin,StructureDefinition/isik-herzfrequenz,StructureDefinition/utn-isik-atemfrequenz,StructureDefinition/isik-koerpertemperatur,StructureDefinition/utn-observation-arterieller-blutdruck","THO"
http://hl7.org/fhir/ValueSet/observation-codes,4.0.1,draft,"2.16.840.1.113883.4.642.3.396",LOINCCodes,LOINC Codes,"This value set includes all LOINC codes","StructureDefinition/isik-koerpergewicht,StructureDefinition/mii-kreatinin,StructureDefinition/isik-herzfrequenz,StructureDefinition/utn-isik-atemfrequenz,StructureDefinition/isik-koerpertemperatur,StructureDefinition/utn-observation-arterieller-blutdruck","LOINC"
http://hl7.org/fhir/ValueSet/observation-interpretation,4.0.1,active,"2.16.840.1.113883.4.642.3.399",ObservationInterpretationCodes,Observation Interpretation Codes,"A categorical assessment, providing a rough qualitative interpretation of the observation value,    such as “normal”/ “abnormal”,”low” / “high”, “better” / “worse”, “susceptible” / “resistant”, “expected”/ “not expected”.    The value set is intended to be for ANY use where coded representation of an interpretation is needed.             Notes:          This is being communicated in v2.x in OBX-8 (Observation Interpretation), in v3 in ObservationInterpretation (CWE) in R1 (Representative Realm) and in FHIR in    Observation.interpretation. Historically these values come from the laboratory domain, and these codes are extensively    used. The value set binding is extensible, so codes outside the value set that are needed for interpretation concepts    (i.e. particular meanings) that are not included in the value set can be used, and these new codes may also be added to    the value set and published in a future version.","StructureDefinition/isik-koerpergewicht,StructureDefinition/mii-kreatinin,StructureDefinition/isik-herzfrequenz,StructureDefinition/utn-isik-atemfrequenz,StructureDefinition/isik-koerpertemperatur,StructureDefinition/utn-observation-arterieller-blutdruck","THO (V3)"
http://hl7.org/fhir/ValueSet/observation-methods,4.0.1,draft,"2.16.840.1.113883.4.642.3.395",ObservationMethods,Observation Methods,"Observation Method codes from [SNOMED CT](http://snomed.info/sct) where concept is-a 272394005 (Technique (qualifier value)) or is-a 129264002 (Action (qualifier value)) or is-a 386053000 (Evaluation procedure(procedure))","StructureDefinition/isik-koerpergewicht,StructureDefinition/mii-kreatinin,StructureDefinition/isik-herzfrequenz,StructureDefinition/utn-isik-atemfrequenz,StructureDefinition/isik-koerpertemperatur,StructureDefinition/utn-observation-arterieller-blutdruck","SCT"
http://hl7.org/fhir/ValueSet/observation-status,4.0.1,active,"2.16.840.1.113883.4.642.3.400",ObservationStatus,ObservationStatus,"Codes providing the status of an observation.","StructureDefinition/isik-koerpergewicht,StructureDefinition/mii-kreatinin,StructureDefinition/isik-herzfrequenz,StructureDefinition/utn-isik-atemfrequenz,StructureDefinition/isik-koerpertemperatur,StructureDefinition/utn-observation-arterieller-blutdruck","hl7.fhir.r4.core"
http://hl7.org/fhir/ValueSet/participant-role,4.0.1,draft,"2.16.840.1.113883.4.642.3.152",ParticipantRoles,Participant Roles,"Roles of participants that may be included in a care team.  Defined as: Is a Person, Healthcare professional (occupation) or Healthcare related organization (qualifier value).","StructureDefinition/utn-service-request","SCT"
http://hl7.org/fhir/ValueSet/patient-contactrelationship,4.0.1,active,"2.16.840.1.113883.4.642.3.1130",PatientContactRelationship,Patient Contact Relationship ,"The nature of the relationship between the patient and the contact person.","StructureDefinition/utn-patient","THO (V2)"
http://hl7.org/fhir/ValueSet/performer-role,4.0.1,draft,"2.16.840.1.113883.4.642.3.433",ProcedurePerformerRoleCodes,Procedure Performer Role Codes,"This example value set defines the set of codes that can be used to indicate a role of a procedure performer.","StructureDefinition/utn-icu-extrakorporales-verfahren,StructureDefinition/utn-procedure,StructureDefinition/utn-procedure-beatmung","SCT"
http://hl7.org/fhir/ValueSet/practitioner-role,4.0.1,draft,"2.16.840.1.113883.4.642.3.439",PractitionerRole,Practitioner role,"This example value set defines a set of codes that can be used to indicate the role of a Practitioner.","StructureDefinition/utn-PR-Base-PractitionerRole","SCT,THO"
http://hl7.org/fhir/ValueSet/procedure-category,4.0.1,draft,"2.16.840.1.113883.4.642.3.430",ProcedureCategoryCodes(SNOMEDCT),Procedure Category Codes (SNOMED CT),"Procedure Category code: A selection of relevant SNOMED CT codes.","StructureDefinition/utn-icu-extrakorporales-verfahren,StructureDefinition/utn-procedure,StructureDefinition/utn-procedure-beatmung","SCT"
http://hl7.org/fhir/ValueSet/procedure-code,4.0.1,draft,"2.16.840.1.113883.4.642.3.427",ProcedureCodes(SNOMEDCT),Procedure Codes (SNOMED CT),"Procedure Code: All SNOMED CT procedure codes.","StructureDefinition/utn-icu-extrakorporales-verfahren,StructureDefinition/utn-procedure,StructureDefinition/utn-service-request,StructureDefinition/utn-procedure-beatmung","SCT"
http://hl7.org/fhir/ValueSet/procedure-followup,4.0.1,draft,"2.16.840.1.113883.4.642.3.429",ProcedureFollowUpCodes(SNOMEDCT),Procedure Follow up Codes (SNOMED CT),"Procedure follow up codes: A selection of SNOMED CT codes relevant to procedure follow up.","StructureDefinition/utn-icu-extrakorporales-verfahren,StructureDefinition/utn-procedure,StructureDefinition/utn-procedure-beatmung","SCT"
http://hl7.org/fhir/ValueSet/procedure-not-performed-reason,4.0.1,active,"2.16.840.1.113883.4.642.3.431",ProcedureNotPerformedReason(SNOMED-CT),Procedure Not Performed Reason (SNOMED-CT),"Situation codes describing the reason that a procedure, which might otherwise be expected, was not performed, or a procedure that was started and was not completed. Consists of SNOMED CT codes, children of procedure contraindicated (183932001), procedure discontinued (416406003), procedure not done (416237000), procedure not indicated (428119001), procedure not offered (416064006), procedure not wanted (416432009), procedure refused (183944003), and procedure stopped (394908001).","StructureDefinition/utn-icu-extrakorporales-verfahren,StructureDefinition/utn-procedure,StructureDefinition/utn-procedure-beatmung","SCT"
http://hl7.org/fhir/ValueSet/procedure-outcome,4.0.1,draft,"2.16.840.1.113883.4.642.3.428",ProcedureOutcomeCodes(SNOMEDCT),Procedure Outcome Codes (SNOMED CT),"Procedure Outcome code: A selection of relevant SNOMED CT codes.","StructureDefinition/utn-icu-extrakorporales-verfahren,StructureDefinition/utn-procedure,StructureDefinition/utn-procedure-beatmung","SCT"
http://hl7.org/fhir/ValueSet/procedure-reason,4.0.1,draft,"2.16.840.1.113883.4.642.3.432",ProcedureReasonCodes,Procedure Reason Codes,"This example value set defines the set of codes that can be used to indicate a reason for a procedure.","StructureDefinition/utn-icu-extrakorporales-verfahren,StructureDefinition/utn-procedure,StructureDefinition/utn-service-request,StructureDefinition/utn-procedure-beatmung","SCT"
http://hl7.org/fhir/ValueSet/program,4.0.1,draft,"2.16.840.1.113883.4.642.3.1383",Program,Program,"This value set defines an example set of codes that could be can be used to classify groupings of service-types/specialties.","StructureDefinition/healthcare-service","THO"
http://hl7.org/fhir/ValueSet/provenance-activity-type,4.0.1,draft,"2.16.840.1.113883.4.642.3.438",ProvenanceActivityType,Provenance activity type,"This value set contains representative Activity Type codes, which includes codes from the HL7 DocumentCompletion, ActStatus, and DataOperations code system, W3C PROV-DM and PROV-N concepts and display names, several HL7 Lifecycle Event codes for which there are agreed upon definitions, and non-duplicated codes from the HL7 Security and Privacy Ontology Operations codes.","StructureDefinition/consent-management-provenance","THO (V3)"
http://hl7.org/fhir/ValueSet/provenance-agent-type,4.0.1,draft,"2.16.840.1.113883.4.642.3.1003",ProvenanceParticipantType,Provenance participant type,"The type of participation a provenance participant.","StructureDefinition/consent-management-provenance","THO"
http://hl7.org/fhir/ValueSet/provenance-entity-role,4.0.1,draft,"2.16.840.1.113883.4.642.3.436",ProvenanceEntityRole,ProvenanceEntityRole,"How an entity was used in an activity.","StructureDefinition/consent-management-provenance","hl7.fhir.r4.core"
http://hl7.org/fhir/ValueSet/publication-status,4.0.1,active,"2.16.840.1.113883.4.642.3.3",PublicationStatus,PublicationStatus,"The lifecycle status of an artifact.","StructureDefinition/utn-consent-id","hl7.fhir.r4.core"
http://hl7.org/fhir/ValueSet/quantity-comparator,4.0.1,active,"2.16.840.1.113883.4.642.3.59",QuantityComparator,QuantityComparator,"How the Quantity should be understood and represented.","StructureDefinition/isik-koerpergewicht,StructureDefinition/mii-kreatinin,StructureDefinition/isik-herzfrequenz,StructureDefinition/utn-isik-atemfrequenz,StructureDefinition/isik-koerpertemperatur,StructureDefinition/utn-observation-arterieller-blutdruck","hl7.fhir.r4.core"
http://hl7.org/fhir/ValueSet/questionnaire-answers,4.0.1,draft,"2.16.840.1.113883.4.642.3.446",QuestionnaireAnswerCodes,Questionnaire Answer Codes,"Example list of codes for answers to questions. (Not complete or necessarily appropriate.)","StructureDefinition/profile-consent-management-questionnaireresponse","SCT"
http://hl7.org/fhir/ValueSet/questionnaire-answers-status,4.0.1,draft,"required",QuestionnaireResponseStatus,QuestionnaireResponseStatus,"Lifecycle status of the questionnaire response.","StructureDefinition/profile-consent-management-questionnaireresponse","hl7.fhir.r4.core"
http://hl7.org/fhir/ValueSet/referencerange-appliesto,4.0.1,draft,"2.16.840.1.113883.4.642.3.407",ObservationReferenceRangeAppliesToCodes,Observation Reference Range Applies To Codes,"This value set defines a set of codes that can be used to indicate the particular target population the reference range applies to.","StructureDefinition/isik-koerpergewicht,StructureDefinition/mii-kreatinin,StructureDefinition/isik-herzfrequenz,StructureDefinition/utn-isik-atemfrequenz,StructureDefinition/isik-koerpertemperatur,StructureDefinition/utn-observation-arterieller-blutdruck","SCT"
http://hl7.org/fhir/ValueSet/referencerange-meaning,4.0.1,draft,"2.16.840.1.113883.4.642.3.397",ObservationReferenceRangeMeaningCodes,Observation Reference Range Meaning Codes,"This value set defines a set of codes that can be used to indicate the meaning/use of a reference range for a particular target population.","StructureDefinition/isik-koerpergewicht,StructureDefinition/mii-kreatinin,StructureDefinition/isik-herzfrequenz,StructureDefinition/utn-isik-atemfrequenz,StructureDefinition/isik-koerpertemperatur,StructureDefinition/utn-observation-arterieller-blutdruck","THO"
http://hl7.org/fhir/ValueSet/report-codes,4.0.1,draft,"2.16.840.1.113883.4.642.3.233",LOINCDiagnosticReportCodes,LOINC Diagnostic Report Codes,"This value set includes LOINC codes that relate to Diagnostic Observations.","StructureDefinition/utn-diagnostik-report","LOINC"
http://hl7.org/fhir/ValueSet/request-intent,4.0.1,draft,"2.16.840.1.113883.4.642.3.113",RequestIntent,RequestIntent,"Codes indicating the degree of authority/intentionality associated with a request.","StructureDefinition/utn-service-request","hl7.fhir.r4.core"
http://hl7.org/fhir/ValueSet/request-priority,4.0.1,draft,"2.16.840.1.113883.4.642.3.115",RequestPriority,Request priority,"The clinical priority of a diagnostic order.","StructureDefinition/utn-service-request,StructureDefinition/teleconsult-communication","hl7.fhir.r4.core"
http://hl7.org/fhir/ValueSet/request-status,4.0.1,draft,"2.16.840.1.113883.4.642.3.111",RequestStatus,RequestStatus,"Codes identifying the lifecycle stage of a request.","StructureDefinition/utn-service-request","hl7.fhir.r4.core"
http://hl7.org/fhir/ValueSet/resource-types,4.0.1,active,"2.16.840.1.113883.4.642.3.27",ResourceType,ResourceType,"One of the resource types defined as part of this version of FHIR.","StructureDefinition/consent-management-provenance,StructureDefinition/mii-kreatinin,StructureDefinition/KBV-PR-Base-Practitioner,StructureDefinition/utn-consent-documentreference-id,StructureDefinition/profile-consent-management-questionnaireresponse,StructureDefinition/utn-consent-id","hl7.fhir.r4.core"
http://hl7.org/fhir/ValueSet/security-labels,4.0.1,active,"2.16.840.1.113883.4.642.3.47",All Security Labels,SecurityLabels,"A single value set for all security labels defined by FHIR.","StructureDefinition/mii-kreatinin,StructureDefinition/utn-documentreference,StructureDefinition/utn-icu-extrakorporales-verfahren,StructureDefinition/utn-encounter,StructureDefinition/utn-procedure,StructureDefinition/utn-consent-documentreference-id,StructureDefinition/utn-procedure-beatmung,StructureDefinition/utn-consent-id",
http://hl7.org/fhir/ValueSet/security-role-type,4.0.1,draft,"2.16.840.1.113883.4.642.3.978",SecurityRoleType,SecurityRoleType,"This example FHIR value set is comprised of example Actor Type codes, which can be used to value FHIR agents, actors, and other role         elements such as those specified in financial transactions. The FHIR Actor value set is based on    DICOM Audit Message, C402;   ASTM Standard, E1762-95 [2013]; selected codes and          derived actor roles from HL7 RoleClass OID 2.16.840.1.113883.5.110;    HL7 Role Code 2.16.840.1.113883.5.111, including AgentRoleType;          HL7 ParticipationType OID: 2.16.840.1.113883.5.90; and    HL7 ParticipationFunction codes OID: 2.16.840.1.113883.5.88.           This value set includes, by reference, role codes from external code systems: NUCC Health Care Provider Taxonomy OID: 2.16.840.1.113883.6.101;          North American Industry Classification System [NAICS]OID: 2.16.840.1.113883.6.85; IndustryClassificationSystem 2.16.840.1.113883.1.11.16039;          and US Census Occupation Code OID: 2.16.840.1.113883.6.243 for relevant recipient or custodian codes not included in this value set.            If no source is indicated in the definition comments, then these are example FHIR codes.          It can be extended with appropriate roles described by SNOMED as well as those described in the HL7 Role Based Access Control Catalog and the          HL7 Healthcare (Security and Privacy) Access Control Catalog.            In Role-Based Access Control (RBAC), permissions are operations on an object that a user wishes to access. Permissions are grouped into roles.          A role characterizes the functions a user is allowed to perform. Roles are assigned to users. If the user's role has the appropriate permissions          to access an object, then that user is granted access to the object. FHIR readily enables RBAC, as FHIR Resources are object types and the CRUDE          events (the FHIR equivalent to permissions in the RBAC scheme) are operations on those objects.          In Attribute-Based Access Control (ABAC), a user requests to perform operations on objects. That user's access request is granted or denied          based on a set of access control policies that are specified in terms of attributes and conditions. FHIR readily enables ABAC, as instances of          a Resource in FHIR (again, Resources are object types) can have attributes associated with them. These attributes include security tags,          environment conditions, and a host of user and object characteristics, which are the same attributes as those used in ABAC. Attributes help          define the access control policies that determine the operations a user may perform on a Resource (in FHIR) or object (in ABAC). For example,          a tag (or attribute) may specify that the identified Resource (object) is not to be further disclosed without explicit consent from the patient.","StructureDefinition/consent-management-provenance,StructureDefinition/utn-consent-id","THO (V3),Internal,THO"
http://hl7.org/fhir/ValueSet/service-category,4.0.1,draft,"2.16.840.1.113883.4.642.3.516",ServiceCategory,Service category,"This value set defines an example set of codes that can be used to classify groupings of service-types/specialties.","StructureDefinition/healthcare-service","THO"
http://hl7.org/fhir/ValueSet/service-provision-conditions,4.0.1,draft,"2.16.840.1.113883.4.642.3.514",ServiceProvisionConditions,ServiceProvisionConditions,"The code(s) that detail the conditions under which the healthcare service is available/offered.","StructureDefinition/healthcare-service","THO"
http://hl7.org/fhir/ValueSet/service-referral-method,4.0.1,draft,"2.16.840.1.113883.4.642.3.510",ReferralMethod,ReferralMethod,"The methods of referral can be used when referring to a specific HealthCareService resource.","StructureDefinition/healthcare-service","THO"
http://hl7.org/fhir/ValueSet/service-type,4.0.1,draft,"2.16.840.1.113883.4.642.3.518",ServiceType,Service type,"This value set defines an example set of codes of service-types.","StructureDefinition/utn-encounter,StructureDefinition/healthcare-service","THO"
http://hl7.org/fhir/ValueSet/servicerequest-category,4.0.1,draft,"2.16.840.1.113883.4.642.3.434",ServiceRequestCategoryCodes,Service Request Category Codes,"An example value set of SNOMED CT concepts that can classify a requested service","StructureDefinition/utn-service-request","SCT"
http://hl7.org/fhir/ValueSet/servicerequest-orderdetail,4.0.1,draft,"2.16.840.1.113883.4.642.3.435",ServiceRequestOrderDetailsCodes,Service Request Order Details Codes,"An example value set of Codified order entry details concepts.  These concepts only make sense in the context of what is being ordered.  This example is for a patient ventilation order","StructureDefinition/utn-service-request","SCT"
http://hl7.org/fhir/uv/ips/ValueSet/results-laboratory-observations-uv-ips,1.1.0,active,,ResultsLaboratoryObservationUvIps,Results Laboratory Observation - IPS,"Value Set Definition: LOINC {STATUS in {ACTIVE}, CLASSTYPE in {1}, CLASS exclude {CHALSKIN, H&P.HX.LAB, LABORDERS, NR STATS, PATH, PATH.\*, MOLPATH, MOLPATH.\*, CYTO, HL7.CYTOGEN, HL7.GENETICS}}","StructureDefinition/mii-kreatinin","LOINC"
http://terminology.hl7.org/ValueSet/v2-0092,2.0.0,active,"2.16.840.1.113883.21.40",Hl7VSReAdmissionIndicator,hl7VS-re-admissionIndicator,"Value Set of codes which are used to specify that a patient is being re-admitted to a healthcare facility from which they were discharged, and indicates the circumstances around such re-admission.","StructureDefinition/utn-encounter","THO (V2)"
http://terminology.hl7.org/ValueSet/v3-ActCode,3.0.0,active,,ActCode,v3 Code System ActCode,"A code specifying the particular kind of Act that the Act-instance represents within its class.  Constraints:  The kind of Act (e.g. physical examination, serum potassium, inpatient encounter, charge financial transaction, etc.) is specified with a code from one of several, typically external, coding systems.  The coding system will depend on the class of Act, such as LOINC for observations, etc. Conceptually, the Act.code must be a specialization of the Act.classCode. This is why the structure of ActClass domain should be reflected in the superstructure of the ActCode domain and then individual codes or externally referenced vocabularies subordinated under these domains that reflect the ActClass structure. Act.classCode and Act.code are not modifiers of each other but the Act.code concept should really imply the Act.classCode concept. For a negative example, it is not appropriate to use an Act.code ""potassium"" together with and Act.classCode for ""laboratory observation"" to somehow mean ""potassium laboratory observation"" and then use the same Act.code for ""potassium"" together with Act.classCode for ""medication"" to mean ""substitution of potassium"". This mutually modifying use of Act.code and Act.classCode is not permitted.","StructureDefinition/utn-documentreference,StructureDefinition/utn-consent-documentreference-id","THO (V3)"
http://terminology.hl7.org/ValueSet/v3-ActEncounterCode,3.0.0,active,"2.16.840.1.113883.1.11.13955",ActEncounterCode,ActEncounterCode,"Domain provides codes that qualify the ActEncounterClass (ENC)","StructureDefinition/utn-encounter","THO (V3)"
http://terminology.hl7.org/ValueSet/v3-ActPriority,3.0.0,active,"2.16.840.1.113883.1.11.16866",ActPriority,ActPriority,"A code or set of codes (e.g., for routine, emergency,) specifying the urgency under which the Act happened, can happen, is happening, is intended to happen, or is requested/demanded to happen.    *Discussion:* This attribute is used in orders to indicate the ordered priority, and in event documentation it indicates the actual priority used to perform the act. In definition mood it indicates the available priorities.","StructureDefinition/utn-encounter","THO (V3)"
http://terminology.hl7.org/ValueSet/v3-ParticipationMode,3.0.0,active,"2.16.840.1.113883.1.11.16543",ParticipationMode,ParticipationMode,"Identifies the primary means by which an Entity participates in an Act.","StructureDefinition/teleconsult-communication","THO (V3)"
http://terminology.hl7.org/ValueSet/v3-PurposeOfUse,3.1.0,active,"2.16.840.1.113883.1.11.20448",PurposeOfUse,PurposeOfUse,"Supports communication of purpose of use at a general level.","StructureDefinition/consent-management-provenance,StructureDefinition/utn-consent-id","THO (V3)"
http://terminology.hl7.org/ValueSet/v3-ServiceDeliveryLocationRoleType,3.0.0,active,"2.16.840.1.113883.1.11.17660",ServiceDeliveryLocationRoleType,ServiceDeliveryLocationRoleType,"A role of a place that further classifies the setting (e.g., accident site, road side, work site, community location) in which services are delivered.","StructureDefinition/utn-service-request","THO (V3)"
https://fhir.kbv.de/ValueSet/KBV_VS_Base_Practitioner_Speciality,1.7.0,active,,KBV_VS_Base_Practitioner_Speciality,Practitioner Speciality,"Dieses Valueset enthält die Codes zur Beschreibung von Practitioner Speciality.","StructureDefinition/KBV-PR-Base-Practitioner",
https://fhir.kbv.de/ValueSet/KBV_VS_Base_Role_Care,1.7.0,active,,KBV_VS_Base_Role_Care,Rolle in Bezug auf die Einrichtung,"Dieses Valueset enthält die Codes zur Beschreibung von Rolle in Bezug auf die Einrichtung.","StructureDefinition/utn-PR-Base-PractitionerRole","kbv.basis"
