URL,Version,Status,OIDs,Name,Title,Descriptino,Uses,Used,Sources
http://example.org/fhir/CodeSystem/gridhamd-answer-options-vs1,0.1.0,draft,,GRIDHAMDAnswerOptionsVSQ1,GRID-HAMD Answer Options ValueSet,"ValueSet including Q1 of the GRID-HAMD Questionnaire answer options.","Questionnaire/GRIDHAMDQuestionnaire","Internal"
http://example.org/fhir/CodeSystem/gridhamd-answer-options-vs10,0.1.0,draft,,GRIDHAMDAnswerOptionsVSQ10,GRID-HAMD Answer Options ValueSet,"ValueSet including Q10 of the GRID-HAMD Questionnaire answer options.","Questionnaire/GRIDHAMDQuestionnaire","Internal"
http://example.org/fhir/CodeSystem/gridhamd-answer-options-vs11,0.1.0,draft,,GRIDHAMDAnswerOptionsVSQ11,GRID-HAMD Answer Options ValueSet,"ValueSet including Q11 of the GRID-HAMD Questionnaire answer options.","Questionnaire/GRIDHAMDQuestionnaire","Internal"
http://example.org/fhir/CodeSystem/gridhamd-answer-options-vs12,0.1.0,draft,,GRIDHAMDAnswerOptionsVSQ12,GRID-HAMD Answer Options ValueSet,"ValueSet including Q12 of the GRID-HAMD Questionnaire answer options.","Questionnaire/GRIDHAMDQuestionnaire","Internal"
http://example.org/fhir/CodeSystem/gridhamd-answer-options-vs13,0.1.0,draft,,GRIDHAMDAnswerOptionsVSQ13,GRID-HAMD Answer Options ValueSet,"ValueSet including Q13 of the GRID-HAMD Questionnaire answer options.","Questionnaire/GRIDHAMDQuestionnaire","Internal"
http://example.org/fhir/CodeSystem/gridhamd-answer-options-vs14,0.1.0,draft,,GRIDHAMDAnswerOptionsVSQ14,GRID-HAMD Answer Options ValueSet,"ValueSet including Q14 of the GRID-HAMD Questionnaire answer options.","Questionnaire/GRIDHAMDQuestionnaire","Internal"
http://example.org/fhir/CodeSystem/gridhamd-answer-options-vs15,0.1.0,draft,,GRIDHAMDAnswerOptionsVSQ15,GRID-HAMD Answer Options ValueSet,"ValueSet including Q15 of the GRID-HAMD Questionnaire answer options.","Questionnaire/GRIDHAMDQuestionnaire","Internal"
http://example.org/fhir/CodeSystem/gridhamd-answer-options-vs16,0.1.0,draft,,GRIDHAMDAnswerOptionsVSQ16,GRID-HAMD Answer Options ValueSet,"ValueSet including Q16 of the GRID-HAMD Questionnaire answer options.","Questionnaire/GRIDHAMDQuestionnaire","Internal"
http://example.org/fhir/CodeSystem/gridhamd-answer-options-vs17,0.1.0,draft,,GRIDHAMDAnswerOptionsVSQ17,GRID-HAMD Answer Options ValueSet,"ValueSet including Q17 of the GRID-HAMD Questionnaire answer options.","Questionnaire/GRIDHAMDQuestionnaire","Internal"
http://example.org/fhir/CodeSystem/gridhamd-answer-options-vs2,0.1.0,draft,,GRIDHAMDAnswerOptionsVSQ2,GRID-HAMD Answer Options ValueSet,"ValueSet including Q2 of the GRID-HAMD Questionnaire answer options.","Questionnaire/GRIDHAMDQuestionnaire","Internal"
http://example.org/fhir/CodeSystem/gridhamd-answer-options-vs3,0.1.0,draft,,GRIDHAMDAnswerOptionsVSQ3,GRID-HAMD Answer Options ValueSet,"ValueSet including Q3 of the GRID-HAMD Questionnaire answer options.","Questionnaire/GRIDHAMDQuestionnaire","Internal"
http://example.org/fhir/CodeSystem/gridhamd-answer-options-vs4,0.1.0,draft,,GRIDHAMDAnswerOptionsVSQ4,GRID-HAMD Answer Options ValueSet,"ValueSet including Q4 of the GRID-HAMD Questionnaire answer options.","Questionnaire/GRIDHAMDQuestionnaire","Internal"
http://example.org/fhir/CodeSystem/gridhamd-answer-options-vs5,0.1.0,draft,,GRIDHAMDAnswerOptionsVSQ5,GRID-HAMD Answer Options ValueSet,"ValueSet including Q5 of the GRID-HAMD Questionnaire answer options.","Questionnaire/GRIDHAMDQuestionnaire","Internal"
http://example.org/fhir/CodeSystem/gridhamd-answer-options-vs6,0.1.0,draft,,GRIDHAMDAnswerOptionsVSQ6,GRID-HAMD Answer Options ValueSet,"ValueSet including Q6 of the GRID-HAMD Questionnaire answer options.","Questionnaire/GRIDHAMDQuestionnaire","Internal"
http://example.org/fhir/CodeSystem/gridhamd-answer-options-vs7,0.1.0,draft,,GRIDHAMDAnswerOptionsVSQ7,GRID-HAMD Answer Options ValueSet,"ValueSet including Q7 of the GRID-HAMD Questionnaire answer options.","Questionnaire/GRIDHAMDQuestionnaire","Internal"
http://example.org/fhir/CodeSystem/gridhamd-answer-options-vs8,0.1.0,draft,,GRIDHAMDAnswerOptionsVSQ8,GRID-HAMD Answer Options ValueSet,"ValueSet including Q8 of the GRID-HAMD Questionnaire answer options.","Questionnaire/GRIDHAMDQuestionnaire","Internal"
http://example.org/fhir/CodeSystem/gridhamd-answer-options-vs9,0.1.0,draft,,GRIDHAMDAnswerOptionsVSQ9,GRID-HAMD Answer Options ValueSet,"ValueSet including Q9 of the GRID-HAMD Questionnaire answer options.","Questionnaire/GRIDHAMDQuestionnaire","Internal"
http://fhir.de/ConsentManagement/ValueSet/ContextIdentifierType,1.0.1,active,,ConsentManagementContextIdentifierType,,"","StructureDefinition/utn-patient","THO (V2),de.basisprofil.r4"
http://fhir.de/ValueSet/DiagnoseTyp,1.5.2,active,,DiagnoseTyp,DiagnoseTyp ValueSet,"DiagnoseTyp ValueSet","StructureDefinition/utn-encounter","de.basisprofil.r4"
http://fhir.de/ValueSet/Diagnosesubtyp,1.5.2,active,,Diagnosesubtyp,Diagnosesubtyp ValueSet,"Diagnosesubtyp ValueSet","StructureDefinition/utn-encounter","de.basisprofil.r4,THO"
http://fhir.de/ValueSet/EncounterClassDE,1.5.2,active,,EncounterClassDE,EncounterClassDE,"Fallarten und Patientenstatus zur Codierung von Encounter.class","StructureDefinition/utn-encounter","THO (V3)"
http://fhir.de/ValueSet/EncounterStatusDe,1.5.2,active,,EncounterStatusDe,Encounter Status ValueSet,"Einschränkung von Encounter Status in Vorbereitung auf Änderungen in FHIR R5","StructureDefinition/utn-encounter","hl7.fhir.r4.core"
http://fhir.de/ValueSet/UcumVitalsCommonDE,1.5.2,active,,UCUM_Vitals_Common_DE,UCUM Vitals Common DE,"Alle innerhalb der VitalSign Profile (DE) erlaubten UCUM Einheiten für value[x]","StructureDefinition/isik-koerpergewicht,StructureDefinition/isik-herzfrequenz,StructureDefinition/utn-isik-atemfrequenz,StructureDefinition/isik-koerpertemperatur,StructureDefinition/utn-observation-arterieller-blutdruck","UCUM"
http://fhir.de/ValueSet/VitalSignDE-Atemfrequenz-SNOMED-CT,1.5.2,active,,VitalSignDE_Atemfrequenz_SNOMED_CT,VitalSignDE_Atemfrequenz_SNOMED_CT,"VitalSignDE_Atemfrequenz_SNOMED_CT enthält die erwarteten $sct Codes für Atemfrequenz","StructureDefinition/utn-isik-atemfrequenz","SCT"
http://fhir.de/ValueSet/VitalSignDE_Body_Weight_Loinc,1.5.0,active,,VitalSignDE_Body_Weight_Loinc,VitalSignDE_Body_Weight_Loinc,"VitalSignDE_Body_Weight_Loinc enthält Codes zur Kodierung der Messung eines Körpergewichtes (inkl. Gewicht bei der Geburt)","StructureDefinition/isik-koerpergewicht","LOINC"
http://fhir.de/ValueSet/VitalSignDE_Body_Weigth_UCUM,1.5.2,active,,VitalSignDE_Body_Weigth_UCUM,VitalSignDE_Body_Weigth_UCUM,"VitalSignDE_Body_Weigth_UCUM enthält alle validen Einheiten zur Kodierung eines Körpergewichtes","StructureDefinition/isik-koerpergewicht","UCUM"
http://fhir.de/ValueSet/bfarm/ops,1.5.2,active,,OpsVS,OPS ValueSet,"OPS ValueSet","StructureDefinition/utn-icu-extrakorporales-verfahren,StructureDefinition/utn-procedure,StructureDefinition/utn-procedure-beatmung","de.medizininformatikinitiative.kerndatensatz.prozedur"
http://fhir.de/ValueSet/dgkev/Aufnahmeanlass,1.5.2,active,,AufnahmeanlassVS,Aufnahmeanlass ValueSet,"Aufnahmeanlass, Datenübermittlung nach § 301 Abs. 3 SGB V","StructureDefinition/utn-encounter","de.basisprofil.r4"
http://fhir.de/ValueSet/dkgev/AufnahmegrundDritteStelle,1.5.2,active,,AufnahmegrundDritteStelleVS,AufnahmegrundDritteStelle ValueSet,"Aufnahmegrund (3. Stelle), Datenübermittlung nach § 301 Abs. 3 SGB V","StructureDefinition/utn-encounter","de.basisprofil.r4"
http://fhir.de/ValueSet/dkgev/AufnahmegrundErsteUndZweiteStelle,1.5.2,active,,AufnahmegrundErsteUndZweiteStelleVS,Aufnahmegrund Erste und Zweite Stelle ValueSet,"Aufnahmegrund (1. und 2. Stelle), Datenübermittlung nach § 301 Abs. 3 SGB V","StructureDefinition/utn-encounter","de.basisprofil.r4"
http://fhir.de/ValueSet/dkgev/AufnahmegrundVierteStelle,1.5.2,active,,AufnahmegrundVierteStelleVS,Aufnahmegrund Vierte Stelle ValueSet,"Aufnahmegrund (4. Stelle), Datenübermittlung nach § 301 Abs. 3 SGB V","StructureDefinition/utn-encounter","de.basisprofil.r4"
http://fhir.de/ValueSet/dkgev/Fachabteilungsschluessel,1.5.2,active,,FachabteilungsschluesselVS,Fachabteilungsschlüssel ValueSet,"Fachabteilungen gemäß Anhang 1 der BPflV in der am 31.12.2003 geltenden Fassung","StructureDefinition/utn-encounter","de.basisprofil.r4"
http://fhir.de/ValueSet/dkgev/Fachabteilungsschluessel-erweitert,1.5.2,active,,ValueSetFachabteilungsschluesselErweitert,FachabteilungsschluesselErweitert ValueSet,"Fachabteilungen gemäß Anhang 1 der BPflV in der am 31.12.2003 geltenden Fassung inkl. Spezialisierungen","StructureDefinition/utn-encounter","de.basisprofil.r4"
http://fhir.de/ValueSet/identifier-type-de-basis,1.5.2,active,,IdentifierTypeDeBasis,Identifier Type DeBasis ValueSet,"ValueSet zur Codierung des Identifier-Typs","StructureDefinition/KBV-PR-Base-Practitioner","THO (V2),de.basisprofil.r4"
http://fhir.de/ValueSet/kontaktart-de,1.5.2,active,,KontaktartDe,KontaktartDe ValueSet,"Kontaktarten für die Codierung von Encounter.type","StructureDefinition/utn-encounter","de.basisprofil.r4"
http://fhir.de/ValueSet/kontaktebene-de,1.5.2,active,,KontaktebeneDe,KontaktebeneDe ValueSet,"Kontaktebene für die Codierung von Encounter.type","StructureDefinition/utn-encounter","de.basisprofil.r4"
http://hl7.org/fhir/ValueSet/administrative-gender,4.0.1,active,"2.16.840.1.113883.4.642.3.1",AdministrativeGender,AdministrativeGender,"The gender of a person used for administrative purposes.","StructureDefinition/utn-patient,StructureDefinition/KBV-PR-Base-Practitioner","hl7.fhir.r4.core"
http://hl7.org/fhir/ValueSet/body-site,4.0.1,draft,"2.16.840.1.113883.4.642.3.141",SNOMEDCTBodyStructures,SNOMED CT Body Structures,"This value set includes all codes from [SNOMED CT](http://snomed.info/sct) where concept is-a 442083009 (Anatomical or acquired body site (body structure)).","StructureDefinition/isik-koerpergewicht,StructureDefinition/mii-kreatinin,StructureDefinition/utn-icu-extrakorporales-verfahren,StructureDefinition/utn-procedure,StructureDefinition/utn-service-request,StructureDefinition/isik-herzfrequenz,StructureDefinition/utn-isik-atemfrequenz,StructureDefinition/utn-procedure-beatmung,StructureDefinition/isik-koerpertemperatur,StructureDefinition/utn-observation-arterieller-blutdruck","SCT"
http://hl7.org/fhir/ValueSet/c80-doc-typecodes,4.0.1,active,"2.16.840.1.113883.3.88.12.80.47",DocumentTypeValueSet,Document Type Value Set,"This is the code specifying the precise type of document (e.g. Pulmonary History and  Physical, Discharge Summary, Ultrasound Report, etc.). The Document Type value set includes all LOINC  values listed in HITSP C80 Table 2-144 Document Class Value Set Definition above used for Document Class,  and all LOINC values whose SCALE is DOC in the LOINC database.","StructureDefinition/utn-documentreference,StructureDefinition/utn-consent-documentreference-id","LOINC"
http://hl7.org/fhir/ValueSet/c80-facilitycodes,4.0.1,active,"2.16.840.1.113883.3.88.12.80.67",FacilityTypeCodeValueSet,Facility Type Code Value Set,"This is the code representing the type of organizational setting where the clinical encounter, service, interaction, or treatment occurred. The value set used for Healthcare Facility Type has been defined by HITSP to be the value set reproduced from HITSP C80 Table 2-147.","StructureDefinition/utn-documentreference,StructureDefinition/utn-consent-documentreference-id","SCT"
http://hl7.org/fhir/ValueSet/c80-practice-codes,4.0.1,active,"2.16.840.1.113883.3.88.12.80.72",PracticeSettingCodeValueSet,Practice Setting Code Value Set,"This is the code representing the clinical specialty of the clinician or provider who interacted with, treated, or provided a service to/for the patient. The value set used for clinical specialty has been limited by HITSP to the value set reproduced from HITSP C80 Table 2-149 Clinical Specialty Value Set Definition.","StructureDefinition/utn-documentreference,StructureDefinition/utn-consent-documentreference-id,StructureDefinition/healthcare-service,StructureDefinition/utn-PR-Base-PractitionerRole","SCT"
http://hl7.org/fhir/ValueSet/clinical-findings,4.0.1,draft,"2.16.840.1.113883.4.642.3.232",SNOMEDCTClinicalFindings,SNOMED CT Clinical Findings,"This value set includes all the ""Clinical finding"" [SNOMED CT](http://snomed.info/sct) codes - concepts where concept is-a 404684003 (Clinical finding (finding)).","StructureDefinition/utn-diagnostik-report","SCT"
http://hl7.org/fhir/ValueSet/common-tags,4.0.1,draft,"2.16.840.1.113883.4.642.3.79",CommonTags,Common Tags,"Common Tag Codes defined by FHIR project","StructureDefinition/mii-kreatinin,StructureDefinition/utn-icu-extrakorporales-verfahren,StructureDefinition/utn-encounter,StructureDefinition/utn-procedure,StructureDefinition/utn-procedure-beatmung,StructureDefinition/utn-consent-id","THO"
http://hl7.org/fhir/ValueSet/communication-category,4.0.1,draft,"2.16.840.1.113883.4.642.3.172",CommunicationCategory,CommunicationCategory,"Codes for general categories of communications such as alerts, instructions, etc.","StructureDefinition/teleconsult-communication","THO"
http://hl7.org/fhir/ValueSet/communication-not-done-reason,4.0.1,draft,"2.16.840.1.113883.4.642.3.174",CommunicationNotDoneReason,CommunicationNotDoneReason,"Codes for the reason why a communication did not happen.","StructureDefinition/teleconsult-communication","THO"
http://hl7.org/fhir/ValueSet/communication-topic,4.0.1,draft,"2.16.840.1.113883.4.642.3.983",CommunicationTopic,CommunicationTopic,"Codes describing the purpose or content of the communication.","StructureDefinition/teleconsult-communication","THO"
http://hl7.org/fhir/ValueSet/composition-status,4.0.1,draft,"2.16.840.1.113883.4.642.3.241",CompositionStatus,CompositionStatus,"The workflow/clinical status of the composition.","StructureDefinition/utn-documentreference,StructureDefinition/utn-consent-documentreference-id","hl7.fhir.r4.core"
http://hl7.org/fhir/ValueSet/condition-code,4.0.1,draft,"2.16.840.1.113883.4.642.3.161",Condition/Problem/DiagnosisCodes,Condition/Problem/Diagnosis Codes,"Example value set for Condition/Problem/Diagnosis codes.","StructureDefinition/utn-icu-extrakorporales-verfahren,StructureDefinition/utn-procedure,StructureDefinition/utn-procedure-beatmung","SCT"
http://hl7.org/fhir/ValueSet/consent-action,4.0.1,draft,"2.16.840.1.113883.4.642.3.753",ConsentActionCodes,Consent Action Codes,"This value set includes sample Consent Action codes.","StructureDefinition/utn-consent-id","THO"
http://hl7.org/fhir/ValueSet/consent-category,4.0.1,draft,"2.16.840.1.113883.4.642.3.751",ConsentCategoryCodes,Consent Category Codes,"This value set includes sample Consent Directive Type codes, including several consent directive related LOINC codes; HL7 VALUE SET: ActConsentType(2.16.840.1.113883.1.11.19897); examples of US realm consent directive legal descriptions and references to online and/or downloadable forms such as the SSA-827 Authorization to Disclose Information to the Social Security Administration; and other anticipated consent directives related to participation in a clinical trial, medical procedures, reproductive procedures; health care directive (Living Will); advance directive, do not resuscitate (DNR); Physician Orders for Life-Sustaining Treatment (POLST)","StructureDefinition/utn-consent-id","LOINC,THO"
http://hl7.org/fhir/ValueSet/consent-content-class,4.0.1,draft,"2.16.840.1.113883.4.642.3.747",ConsentContentClass,Consent Content Class,"This value set includes the FHIR resource types, along with some other important content class codes","StructureDefinition/utn-consent-id","hl7.fhir.r4.core,Other"
http://hl7.org/fhir/ValueSet/consent-content-code,4.0.1,draft,"2.16.840.1.113883.4.642.3.748",ConsentContentCodes,Consent Content Codes,"This example value set contains all LOINC code","StructureDefinition/utn-consent-id","LOINC"
http://hl7.org/fhir/ValueSet/consent-data-meaning,4.0.1,draft,"2.16.840.1.113883.4.642.3.759",ConsentDataMeaning,ConsentDataMeaning,"How a resource reference is interpreted when testing consent restrictions.","StructureDefinition/utn-consent-id","hl7.fhir.r4.core"
http://hl7.org/fhir/ValueSet/consent-policy,4.0.1,draft,"2.16.840.1.113883.4.642.3.1014",ConsentPolicyRuleCodes,Consent PolicyRule Codes,"This value set includes sample Regulatory consent policy types from the US and other regions.","StructureDefinition/utn-consent-id","THO"
http://hl7.org/fhir/ValueSet/consent-provision-type,4.0.1,draft,"2.16.840.1.113883.4.642.3.757",ConsentProvisionType,ConsentProvisionType,"How a rule statement is applied, such as adding additional consent or removing consent.","StructureDefinition/utn-consent-id","hl7.fhir.r4.core"
http://hl7.org/fhir/ValueSet/consent-scope,4.0.1,draft,"2.16.840.1.113883.4.642.3.761",ConsentScopeCodes,Consent Scope Codes,"This value set includes the four Consent scope codes.","StructureDefinition/utn-consent-id","THO"
http://hl7.org/fhir/ValueSet/consent-state-codes,4.0.1,draft,"2.16.840.1.113883.4.642.3.755",ConsentState,ConsentState,"Indicates the state of the consent.","StructureDefinition/utn-consent-id","hl7.fhir.r4.core"
http://hl7.org/fhir/ValueSet/data-absent-reason,4.0.1,active,"2.16.840.1.113883.4.642.3.5",DataAbsentReason,DataAbsentReason,"Used to specify why the normally expected content of the data element is missing.","StructureDefinition/isik-koerpergewicht,StructureDefinition/mii-kreatinin,StructureDefinition/isik-herzfrequenz,StructureDefinition/utn-isik-atemfrequenz,StructureDefinition/isik-koerpertemperatur,StructureDefinition/utn-observation-arterieller-blutdruck","THO"
http://hl7.org/fhir/ValueSet/days-of-week,4.0.1,active,"2.16.840.1.113883.4.642.3.512",DaysOfWeek,DaysOfWeek,"The days of the week.","StructureDefinition/healthcare-service,StructureDefinition/utn-PR-Base-PractitionerRole","hl7.fhir.r4.core"
http://hl7.org/fhir/ValueSet/device-action,4.0.1,draft,"2.16.840.1.113883.4.642.3.425",ProcedureDeviceActionCodes,Procedure Device Action Codes,"Example codes indicating the change that happened to the device during the procedure.  Note that these are in no way complete and might not even be appropriate for some uses.","StructureDefinition/utn-icu-extrakorporales-verfahren,StructureDefinition/utn-procedure,StructureDefinition/utn-procedure-beatmung","SCT"
http://hl7.org/fhir/ValueSet/device-kind,4.0.1,draft,"2.16.840.1.113883.4.642.3.208",FHIRDeviceTypes,FHIR Device Types,"Codes used to identify medical devices. Includes concepts from SNOMED CT (http://www.snomed.org/) where concept is-a 49062001 (Device)  and is provided as a suggestive example.","StructureDefinition/utn-icu-extrakorporales-verfahren,StructureDefinition/utn-procedure,StructureDefinition/utn-procedure-beatmung","SCT"
http://hl7.org/fhir/ValueSet/diagnostic-report-status,4.0.1,draft,"2.16.840.1.113883.4.642.3.235",DiagnosticReportStatus,DiagnosticReportStatus,"The status of the diagnostic report.","StructureDefinition/utn-diagnostik-report","hl7.fhir.r4.core"
http://hl7.org/fhir/ValueSet/diagnostic-service-sections,4.0.1,draft,"2.16.840.1.113883.4.642.3.234",DiagnosticServiceSectionCodes,Diagnostic Service Section Codes,"This value set includes all the codes in HL7 V2 table 0074.","StructureDefinition/utn-diagnostik-report","THO (V2)"
http://hl7.org/fhir/ValueSet/document-classcodes,4.0.1,active,"2.16.840.1.113883.3.88.12.80.46",DocumentClassValueSet,Document Class Value Set,"This is the code specifying the high-level kind of document (e.g. Prescription, Discharge Summary, Report, etc.). Note: Class code for documents comes from LOINC, and is based upon one of the following:The type of service described by the document. It is described at a very high level in Section 7.3 of the LOINC Manual. The type study performed. It was determined by identifying modalities for study reports. The section of the chart where the document is placed. It was determined from the SETs created for Claims Attachment requests.","StructureDefinition/utn-documentreference,StructureDefinition/utn-consent-documentreference-id","LOINC"
http://hl7.org/fhir/ValueSet/document-reference-status,4.0.1,draft,"2.16.840.1.113883.4.642.3.7",DocumentReferenceStatus,DocumentReferenceStatus,"The status of the document reference.","StructureDefinition/utn-documentreference,StructureDefinition/utn-consent-documentreference-id","hl7.fhir.r4.core"
http://hl7.org/fhir/ValueSet/document-relationship-type,4.0.1,draft,"2.16.840.1.113883.4.642.3.244",DocumentRelationshipType,DocumentRelationshipType,"The type of relationship between documents.","StructureDefinition/utn-documentreference,StructureDefinition/utn-consent-documentreference-id","hl7.fhir.r4.core"
http://hl7.org/fhir/ValueSet/encounter-diet,4.0.1,draft,"2.16.840.1.113883.4.642.3.255",Diet,Diet,"This value set defines a set of codes that can be used to indicate dietary preferences or restrictions a patient may have.","StructureDefinition/utn-encounter","THO"
http://hl7.org/fhir/ValueSet/encounter-discharge-disposition,4.0.1,draft,"2.16.840.1.113883.4.642.3.259",DischargeDisposition,Discharge disposition,"This value set defines a set of codes that can be used to where the patient left the hospital.","StructureDefinition/utn-encounter","THO"
http://hl7.org/fhir/ValueSet/encounter-location-status,4.0.1,draft,"2.16.840.1.113883.4.642.3.262",EncounterLocationStatus,EncounterLocationStatus,"The status of the location.","StructureDefinition/utn-encounter","hl7.fhir.r4.core"
http://hl7.org/fhir/ValueSet/encounter-participant-type,4.0.1,draft,"2.16.840.1.113883.4.642.3.250",ParticipantType,Participant type,"This value set defines a set of codes that can be used to indicate how an individual participates in an encounter.","StructureDefinition/utn-encounter","THO (V3),THO"
http://hl7.org/fhir/ValueSet/encounter-reason,4.0.1,draft,"2.16.840.1.113883.4.642.3.261",EncounterReasonCodes,Encounter Reason Codes,"This examples value set defines the set of codes that can be used to indicate reasons for an encounter.","StructureDefinition/utn-encounter","SCT"
http://hl7.org/fhir/ValueSet/encounter-special-arrangements,4.0.1,draft,"2.16.840.1.113883.4.642.3.253",SpecialArrangements,Special arrangements,"This value set defines a set of codes that can be used to indicate the kinds of special arrangements in place for a patients visit.","StructureDefinition/utn-encounter","THO"
http://hl7.org/fhir/ValueSet/encounter-special-courtesy,4.0.1,draft,"2.16.840.1.113883.4.642.3.252",SpecialCourtesy,Special courtesy,"This value set defines a set of codes that can be used to indicate special courtesies provided to the patient.","StructureDefinition/utn-encounter","THO (V3)"
http://hl7.org/fhir/ValueSet/encounter-status,4.0.1,draft,"2.16.840.1.113883.4.642.3.246",EncounterStatus,EncounterStatus,"Current state of the encounter.","StructureDefinition/utn-encounter","hl7.fhir.r4.core"
http://hl7.org/fhir/ValueSet/encounter-type,4.0.1,draft,"2.16.840.1.113883.4.642.3.248",EncounterType,Encounter type,"This example value set defines a set of codes that can be used to indicate the type of encounter: a specific code indicating type of service provided.","StructureDefinition/utn-encounter","THO"
http://hl7.org/fhir/ValueSet/event-status,4.0.1,draft,"2.16.840.1.113883.4.642.3.109",EventStatus,EventStatus,"Codes identifying the lifecycle stage of an event.","StructureDefinition/utn-icu-extrakorporales-verfahren,StructureDefinition/utn-procedure,StructureDefinition/utn-procedure-beatmung,StructureDefinition/teleconsult-communication","hl7.fhir.r4.core"
http://hl7.org/fhir/ValueSet/formatcodes,4.0.1,active,"1.3.6.1.4.1.19376.1.2.7.1",DocumentReferenceFormatCodeSet,DocumentReference Format Code Set,"The value set is defined to be the set of format codes defined by the IHE Technical Framework, and also including additional format codes defined by the    HL7. The value set is listed in HITSP C80 Table 2-153 Format Code Value Set Definition,    with additions published later by IHE as published    at http://wiki.ihe.net/index.php?title=IHE_Format_Codes   and with additions published later by HL7 as published at https://confluence.hl7.org/display/SD/Format+Codes+for+IHE+XDS.   This is the code specifying the technical format of the document. Along with the typeCode,    it should provide sufficient information to allow any potential document consumer to know    if it will be able to process the document. The code shall be sufficiently specific to    ensure processing/display by identifying a document encoding, structure and template. The actual list of codes here is incomplete","StructureDefinition/utn-documentreference,StructureDefinition/utn-consent-documentreference-id","Other"
http://hl7.org/fhir/ValueSet/identifier-type,4.0.1,active,"2.16.840.1.113883.4.642.3.45",Identifier Type Codes,IdentifierType,"A coded type for an identifier that can be used to determine which identifier to use for a specific purpose.","StructureDefinition/KBV-PR-Base-Practitioner,StructureDefinition/utn-consent-id","THO (V2)"
http://hl7.org/fhir/ValueSet/identifier-use,4.0.1,active,"2.16.840.1.113883.4.642.3.57",IdentifierUse,IdentifierUse,"Identifies the purpose for this identifier, if known .","StructureDefinition/mii-kreatinin,StructureDefinition/utn-patient,StructureDefinition/utn-encounter,StructureDefinition/KBV-PR-Base-Practitioner,StructureDefinition/utn-consent-id","hl7.fhir.r4.core"
