URL,Version,Status,OIDs,Name,Title,Descriptino,Uses,Used,Sources
https://gematik.de/fhir/isik/ValueSet/ISiKHerzfrequenzSCTVS,4.0.0,active,,ISiKHerzfrequenzSCTVS,ISiKHerzfrequenzSCTVS,"ValueSet des Herzfrequenz SnomedCT Codes in ISiK","StructureDefinition/isik-herzfrequenz","SCT"
https://gematik.de/fhir/isik/ValueSet/ISiKKoerpergewichtSCTVS,4.0.0,active,,ISiKKoerpergewichtSCTVS,ISiKKoerpergewichtSCTVS,"ValueSet des Körpergewichts SnomedCT Codes in ISiK","StructureDefinition/isik-koerpergewicht","SCT"
https://gematik.de/fhir/isik/ValueSet/ISiKKoerpertemperaturSCTVS,4.0.0,active,,ISiKKoerpertemperaturSCTVS,ISiKKoerpertemperaturSCTVS,"ValueSet des Körpergewicht SnomedCT Codes in ISiK","StructureDefinition/isik-koerpertemperatur","SCT"
https://www.medizininformatik-initiative.de/fhir/core/modul-fall/ValueSet/identifier-type-codes,2025.0.0,active,,MII_VS_Fall_IdentifierTypeCodes,MII VS Fall Identifier Type Codes,"A coded type for an identifier that can be used to determine which identifier to use for a specific purpose.","StructureDefinition/utn-encounter","THO (V2)"
https://www.medizininformatik-initiative.de/fhir/core/modul-fall/ValueSet/location-physical-type,2025.0.0,active,,MII_VS_Fall_LocationPhysicalType,MII VS Fall Location Physical Type,"A coded type for the physical type of the location.","StructureDefinition/utn-encounter","THO"
https://www.medizininformatik-initiative.de/fhir/core/modul-fall/ValueSet/mii-vs-fall-diagnosis-use,2025.0.0,active,,MII_VS_Fall_Diagnosis_Use,MII VS Fall Diagnosis Use,"Diagnosetyp","StructureDefinition/utn-encounter",
https://www.medizininformatik-initiative.de/fhir/core/modul-labor/ValueSet/mii-vs-labor-identifier-type-codes,2025.0.2,active,,MII_VS_Labor_Identifier_Type_Codes,MII VS Labor Identifier Type Codes,"Type-Codes, um zu bestimmen, welcher Identifier für einen bestimmten Zweck zu verwenden ist.","StructureDefinition/mii-kreatinin","THO (V2)"
https://www.medizininformatik-initiative.de/fhir/core/modul-prozedur/ValueSet/procedures-category-sct,2025.0.0,active,,MII_VS_Prozedur_OpsKategorien_SNOMEDCT,MII VS Prozedur OPS Kategorien [SNOMED CT],"Enthaelt alle SNOMED CT Codes für ein Mapping der OPS Klassentitel","StructureDefinition/utn-icu-extrakorporales-verfahren,StructureDefinition/utn-procedure","SCT"
https://www.medizininformatik-initiative.de/fhir/core/modul-prozedur/ValueSet/procedures-sct,2025.0.0,active,,MII_VS_Prozedur_Prozeduren_SNOMEDCT,MII VS Prozedur Prozeduren [SNOMED CT],"Enthaelt alle SNOMED CT Procedure Codes","StructureDefinition/utn-procedure","SCT"
https://www.medizininformatik-initiative.de/fhir/ext/modul-icu/ValueSet/vs-mii-icu-category-procedure-beatmung-snomed,2025.0.2,active,,VS_MII_ICU_Category_Procedure_Beatmung_SNOMED,VS MII ICU Category Procedure Beatmung [SNOMED],"","StructureDefinition/utn-procedure-beatmung","SCT"
https://www.medizininformatik-initiative.de/fhir/ext/modul-icu/ValueSet/vs-mii-icu-code-extrakorporale-verfahren,2025.0.2,active,,VS_MII_ICU_Code_Extrakorporale_Verfahren,VS MII ICU Code extrakorporale Verfahren,"Mögliche Codes für extrakorporale Verfahren. Für die Einteilung und Interpretation in Bezug auf unterschiedliche Detail-Level beachte den zugehörigen implementationguide.","StructureDefinition/utn-icu-extrakorporales-verfahren","SCT"
https://www.medizininformatik-initiative.de/fhir/ext/modul-icu/ValueSet/vs-mii-icu-code-procedure-beatmung-snomed,2025.0.2,active,,VS_MII_ICU_Code_Procedure_Beatmung_SNOMED,VS MII ICU Code Procedure Beatmung [SNOMED],"","StructureDefinition/utn-procedure-beatmung","SCT"
https://www.medizininformatik-initiative.de/fhir/modul-consent/ValueSet/mii-vs-consent-signaturetypes,1.0.0,active,,MII_VS_Consent_SignatureTypes,MII Consent: Signature Types,"Dieses ValueSet enthält die zulässigen Werte für den Signaturtyp im Kontext des MI-I Consent.","StructureDefinition/consent-management-provenance","hl7.fhir.r4.core"
